<?xml version="1.0" encoding="UTF-8"?>
<xs:schema xmlns:xs="http://www.w3.org/2001/XMLSchema"
           xmlns:xsi="http://www.w3.org/2001/XMLSchema-instance"
           targetNamespace="http://www.hp.com/simulap/sip"
           xmlns:tns="http://www.hp.com/simulap/sip"
           xmlns:jaxb="http://java.sun.com/xml/ns/jaxb" jaxb:version="2.0"
           xmlns="http://www.hp.com/simulap/sip/headers"
           elementFormDefault="unqualified">
    
    <!-- This schema gathers user group related data structures. -->
    
	<xs:annotation>
		<xs:appinfo>
			<jaxb:schemaBindings>
				<jaxb:package name="com.hp.simulap.sip.headers" />
			</jaxb:schemaBindings>
		</xs:appinfo>
	</xs:annotation>
	
	<!--=================-->
	<!-- Schemas imports -->
	<!--=================-->
	
	<!--======================-->
	<!-- Element declarations -->
	<!--======================-->
	
	<!--===================-->
	<!-- Type declarations -->
	<!--===================-->
	
	<xs:element name="headers" type="tns:headerList"></xs:element>
	
	<xs:complexType name="headerList">
	<xs:sequence>
		<xs:element name="headerelem" type="tns:header" maxOccurs="unbounded" />
	</xs:sequence>
	</xs:complexType>
	
	<!-- This is the definition of the user group type. -->
	<xs:complexType name="header">
    	<xs:annotation>
    		<xs:appinfo>
    			<jaxb:class>
    				<jaxb:javadoc>
    				<![CDATA[
This defines a SIP header.
    				]]></jaxb:javadoc>
    			</jaxb:class>
    		</xs:appinfo>
    	</xs:annotation>
				<xs:sequence>
					<xs:element name="headerName" type="xs:string"/>
					<xs:element name="headerType" type="xs:string"/>
					<xs:element name="headerValue" type="xs:string"/>
				</xs:sequence>
	</xs:complexType>
	
</xs:schema>
